{
  "$schema": "http://json-schema.org/draft-07/schema#",
  "type": "object",
  "title": "reportsViewer Configuration Schema",
  "description": "Auto-generated schema for reportsViewer configuration",
  "_generated": "2025-09-27T07:05:06.941Z",
  "_generator": "componentSchemaGenerator v1.0.0",
  "_version": "0.1.0",
  "properties": {
    "metadata": {
      "type": "object",
      "properties": {
        "name": {
          "type": "string",
          "minLength": 1
        },
        "version": {
          "type": "string",
          "minLength": 1
        },
        "type": {
          "type": "string",
          "enum": [
            "component",
            "service",
            "layout"
          ],
          "minLength": 1
        },
        "dependencies": {
          "type": "array",
          "items": {
            "type": "string",
            "minLength": 1
          },
          "minItems": 0
        },
        "description": {
          "type": "string",
          "minLength": 1
        },
        "author": {
          "type": "string",
          "minLength": 1
        },
        "created": {
          "type": "string",
          "format": "date",
          "pattern": "^\\d{4}-\\d{2}-\\d{2}$",
          "minLength": 1
        }
      },
      "additionalProperties": true
    },
    "ui": {
      "type": "object",
      "properties": {
        "layout": {
          "type": "object",
          "properties": {
            "containerMaxWidth": {
              "type": "string",
              "minLength": 1
            },
            "padding": {
              "type": "string",
              "minLength": 1
            },
            "borderRadius": {
              "type": "string",
              "minLength": 1
            },
            "filtersGrid": {
              "type": "string",
              "minLength": 1
            },
            "summaryGrid": {
              "type": "string",
              "minLength": 1
            },
            "breakdownGrid": {
              "type": "string",
              "minLength": 1
            }
          },
          "additionalProperties": true
        },
        "colors": {
          "type": "object",
          "properties": {
            "background": {
              "type": "string",
              "minLength": 1
            },
            "cardBackground": {
              "type": "string",
              "pattern": "^#[0-9a-fA-F]{6}$",
              "description": "Hex color code",
              "minLength": 1
            },
            "primaryBlue": {
              "type": "string",
              "pattern": "^#[0-9a-fA-F]{6}$",
              "description": "Hex color code",
              "minLength": 1
            },
            "successGreen": {
              "type": "string",
              "pattern": "^#[0-9a-fA-F]{6}$",
              "description": "Hex color code",
              "minLength": 1
            },
            "dangerRed": {
              "type": "string",
              "pattern": "^#[0-9a-fA-F]{6}$",
              "description": "Hex color code",
              "minLength": 1
            },
            "warningYellow": {
              "type": "string",
              "pattern": "^#[0-9a-fA-F]{6}$",
              "description": "Hex color code",
              "minLength": 1
            },
            "textPrimary": {
              "type": "string",
              "minLength": 1
            },
            "textSecondary": {
              "type": "string",
              "minLength": 1
            }
          },
          "additionalProperties": true
        },
        "animations": {
          "type": "object",
          "properties": {
            "buttonHover": {
              "type": "string",
              "minLength": 1
            },
            "transition": {
              "type": "string",
              "minLength": 1
            },
            "pulseAnimation": {
              "type": "string",
              "minLength": 1
            },
            "progressAnimation": {
              "type": "string",
              "minLength": 1
            }
          },
          "additionalProperties": true
        }
      },
      "additionalProperties": true
    },
    "reportFilters": {
      "type": "object",
      "properties": {
        "dateRange": {
          "type": "object",
          "properties": {
            "defaultDays": {
              "type": "number",
              "minimum": 0
            },
            "maxDays": {
              "type": "number",
              "minimum": 0
            },
            "format": {
              "type": "string",
              "minLength": 1
            }
          },
          "additionalProperties": true
        },
        "deviceTypes": {
          "type": "array",
          "items": {
            "type": "object",
            "properties": {
              "id": {
                "type": "string",
                "minLength": 1
              },
              "label": {
                "type": "object",
                "properties": {
                  "pl": {
                    "type": "string",
                    "minLength": 1
                  },
                  "en": {
                    "type": "string",
                    "minLength": 1
                  },
                  "de": {
                    "type": "string",
                    "minLength": 1
                  }
                },
                "additionalProperties": true
              }
            },
            "additionalProperties": true
          },
          "minItems": 0
        },
        "testStatuses": {
          "type": "array",
          "items": {
            "type": "object",
            "properties": {
              "id": {
                "type": "string",
                "minLength": 1
              },
              "label": {
                "type": "object",
                "properties": {
                  "pl": {
                    "type": "string",
                    "minLength": 1
                  },
                  "en": {
                    "type": "string",
                    "minLength": 1
                  },
                  "de": {
                    "type": "string",
                    "minLength": 1
                  }
                },
                "additionalProperties": true
              }
            },
            "additionalProperties": true
          },
          "minItems": 0
        }
      },
      "additionalProperties": true
    },
    "exportFormats": {
      "type": "array",
      "items": {
        "type": "object",
        "properties": {
          "id": {
            "type": "string",
            "minLength": 1
          },
          "label": {
            "type": "string",
            "minLength": 1
          },
          "icon": {
            "type": "string",
            "minLength": 1
          },
          "mimeType": {
            "type": "string",
            "minLength": 1
          }
        },
        "additionalProperties": true
      },
      "minItems": 0
    },
    "api": {
      "type": "object",
      "properties": {
        "endpoints": {
          "type": "object",
          "properties": {
            "generateReport": {
              "type": "string",
              "minLength": 1
            },
            "exportReport": {
              "type": "string",
              "minLength": 1
            },
            "getReportData": {
              "type": "string",
              "minLength": 1
            },
            "getDeviceStats": {
              "type": "string",
              "minLength": 1
            }
          },
          "additionalProperties": true
        },
        "timeout": {
          "type": "number",
          "minimum": 0,
          "maximum": 300000
        },
        "retryAttempts": {
          "type": "number",
          "minimum": 0
        }
      },
      "additionalProperties": true
    },
    "performance": {
      "type": "object",
      "properties": {
        "maxReportSize": {
          "type": "number",
          "minimum": 1,
          "maximum": 65535
        },
        "cacheTimeout": {
          "type": "number",
          "minimum": 0
        },
        "maxExportSize": {
          "type": "number",
          "minimum": 1,
          "maximum": 65535
        },
        "reportGenerationTimeout": {
          "type": "number",
          "minimum": 1,
          "maximum": 65535
        }
      },
      "additionalProperties": true
    },
    "security": {
      "type": "object",
      "properties": {
        "requiredRole": {
          "type": "string",
          "enum": [
            "OPERATOR",
            "ADMIN",
            "SUPERUSER",
            "SERWISANT"
          ],
          "minLength": 1
        },
        "allowedExportFormats": {
          "type": "array",
          "items": {
            "type": "string",
            "minLength": 1
          },
          "minItems": 0
        },
        "maxDateRange": {
          "type": "number",
          "minimum": 0
        },
        "validationRules": {
          "type": "object",
          "properties": {
            "dateFrom": {
              "type": "string",
              "minLength": 1
            },
            "dateTo": {
              "type": "string",
              "minLength": 1
            }
          },
          "additionalProperties": true
        }
      },
      "additionalProperties": true
    },
    "chartConfiguration": {
      "type": "object",
      "properties": {
        "defaultType": {
          "type": "string",
          "minLength": 1
        },
        "colors": {
          "type": "array",
          "items": {
            "type": "string",
            "pattern": "^#[0-9a-fA-F]{6}$",
            "description": "Hex color code",
            "minLength": 1
          },
          "minItems": 0
        },
        "animations": {
          "type": "boolean"
        },
        "responsiveBreakpoints": {
          "type": "array",
          "items": {
            "type": "number",
            "minimum": 0
          },
          "minItems": 0
        }
      },
      "additionalProperties": true
    },
    "localization": {
      "type": "object",
      "properties": {
        "supportedLanguages": {
          "type": "array",
          "items": {
            "type": "string",
            "minLength": 1
          },
          "minItems": 0
        },
        "fallbackLanguage": {
          "type": "string",
          "minLength": 1
        },
        "dateFormats": {
          "type": "object",
          "properties": {
            "pl": {
              "type": "string",
              "minLength": 1
            },
            "en": {
              "type": "string",
              "minLength": 1
            },
            "de": {
              "type": "string",
              "minLength": 1
            }
          },
          "additionalProperties": true
        }
      },
      "additionalProperties": true
    }
  },
  "required": [
    "metadata",
    "ui",
    "reportFilters",
    "api",
    "performance",
    "security",
    "chartConfiguration",
    "localization"
  ],
  "additionalProperties": false
}
